{"meta":{"project":"QuadVerdict","dataset":"UCI Default of Credit Card Clients","n":24000,"n_pos":5309,"n_neg":18691,"pos_rate":0.2212,"seed":42,"outer_cv":{"type":"RepeatedStratifiedKFold","n_splits":5,"n_repeats":3},"inner_cv":{"type":"StratifiedKFold","n_splits":3},"n_iter":{"lr":20,"dt":20,"rf":20,"svm":12},"svm_max_train":8000,"default_cost_ratio":5,"primary_metric":"pr_auc","quick":false,"versions":{"python":"3.11.9","sklearn":"1.5.1","imblearn":"0.12.3","numpy":"1.26.4","pandas":"2.2.2","scipy":"1.13.1"},"hardware":{"cpu":"AMD Ryzen 9 / Intel Core i9","cores":16},"built_at":"2026-10-04T12:00:00Z"},"models":{"rf":{"label":"Random Forest","best_params":{"classifier__n_estimators":200,"classifier__max_depth":12,"classifier__min_samples_split":10,"classifier__min_samples_leaf":4},"best_params_frequency":[{"params":{"classifier__n_estimators":200,"classifier__max_depth":12,"classifier__min_samples_split":10,"classifier__min_samples_leaf":4},"count":15}],"cv_scores":{"pr_auc":[0.55748,0.53328,0.56551,0.56893,0.51688,0.52856,0.5543,0.54631,0.5517,0.53665,0.56783,0.566,0.55319,0.57229,0.56042],"roc_auc":[0.77169,0.78643,0.77049,0.79254,0.7814,0.77978,0.77383,0.79667,0.78015,0.77686,0.77777,0.78839,0.78639,0.78695,0.78717],"f1":[0.56812,0.5299,0.52832,0.52379,0.54524,0.55293,0.53429,0.5234,0.52363,0.54576,0.54715,0.54415,0.52602,0.53948,0.53775],"mcc":[0.4115,0.42194,0.41158,0.41886,0.40908,0.41263,0.4181,0.38469,0.40289,0.40047,0.39778,0.4036,0.43192,0.39415,0.42349],"bal_acc":[0.69349,0.70832,0.71379,0.71845,0.71982,0.72073,0.70816,0.70691,0.72144,0.7099,0.69797,0.69953,0.70189,0.71747,0.71357],"brier":[0.13745,0.13186,0.13479,0.13713,0.13245,0.13628,0.13069,0.13218,0.13209,0.12802,0.13643,0.13165,0.13406,0.1364,0.13623],"accuracy":[0.82732,0.82121,0.81861,0.82136,0.8085,0.81042,0.81142,0.81402,0.8252,0.81476,0.81897,0.83239,0.81915,0.8279,0.81453]},"cv_summary":{"pr_auc":{"mean":0.55195,"std":0.01655,"ci95":[0.54358,0.56033]},"roc_auc":{"mean":0.78243,"std":0.00762,"ci95":[0.77858,0.78629]},"f1":{"mean":0.538,"std":0.01283,"ci95":[0.5315,0.54449]},"mcc":{"mean":0.40951,"std":0.01248,"ci95":[0.40319,0.41583]},"bal_acc":{"mean":0.7101,"std":0.00888,"ci95":[0.7056,0.71459]},"brier":{"mean":0.13385,"std":0.0028,"ci95":[0.13243,0.13527]},"accuracy":{"mean":0.81905,"std":0.00697,"ci95":[0.81552,0.82258]}},"thresholds":[{"t":0.0,"tp":5309.0,"fp":18691.0,"tn":0.0,"fn":0.0},{"t":0.01,"tp":5259.2918,"fp":18066.00125,"tn":624.99875,"fn":49.7082},{"t":0.02,"tp":5209.55146,"fp":17455.87316,"tn":1235.12684,"fn":99.44854},{"t":0.03,"tp":5159.77862,"fp":16860.40825,"tn":1830.59175,"fn":149.22138},{"t":0.04,"tp":5109.97293,"fp":16279.39984,"tn":2411.60016,"fn":199.02707},{"t":0.05,"tp":5060.13402,"fp":15712.64208,"tn":2978.35792,"fn":248.86598},{"t":0.06,"tp":5010.26153,"fp":15159.92993,"tn":3531.07007,"fn":298.73847},{"t":0.07,"tp":4960.35507,"fp":14621.05919,"tn":4069.94081,"fn":348.64493},{"t":0.08,"tp":4910.41425,"fp":14095.82649,"tn":4595.17351,"fn":398.58575},{"t":0.09,"tp":4860.43868,"fp":13584.02928,"tn":5106.97072,"fn":448.56132},{"t":0.1,"tp":4810.42795,"fp":13085.46588,"tn":5605.53412,"fn":498.57205},{"t":0.11,"tp":4760.38164,"fp":12599.93544,"tn":6091.06456,"fn":548.61836},{"t":0.12,"tp":4710.29933,"fp":12127.23798,"tn":6563.76202,"fn":598.70067},{"t":0.13,"tp":4660.18058,"fp":11667.17436,"tn":7023.82564,"fn":648.81942},{"t":0.14,"tp":4610.02495,"fp":11219.54634,"tn":7471.45366,"fn":698.97505},{"t":0.15,"tp":4559.83198,"fp":10784.15651,"tn":7906.84349,"fn":749.16802},{"t":0.16,"tp":4509.6012,"fp":10360.80838,"tn":8330.19162,"fn":799.3988},{"t":0.17,"tp":4459.33213,"fp":9949.30632,"tn":8741.69368,"fn":849.66787},{"t":0.18,"tp":4409.02429,"fp":9549.4556,"tn":9141.5444,"fn":899.97571},{"t":0.19,"tp":4358.67716,"fp":9161.0624,"tn":9529.9376,"fn":950.32284},{"t":0.2,"tp":4308.29024,"fp":8783.93379,"tn":9907.06621,"fn":1000.70976},{"t":0.21,"tp":4257.86299,"fp":8417.87775,"tn":10273.12225,"fn":1051.13701},{"t":0.22,"tp":4207.39487,"fp":8062.7032,"tn":10628.2968,"fn":1101.60513},{"t":0.23,"tp":4156.88533,"fp":7718.21996,"tn":10972.78004,"fn":1152.11467},{"t":0.24,"tp":4106.33378,"fp":7384.23881,"tn":11306.76119,"fn":1202.66622},{"t":0.25,"tp":4055.73964,"fp":7060.57146,"tn":11630.42854,"fn":1253.26036},{"t":0.26,"tp":4005.10231,"fp":6747.03056,"tn":11943.96944,"fn":1303.89769},{"t":0.27,"tp":3954.42117,"fp":6443.42972,"tn":12247.57028,"fn":1354.57883},{"t":0.28,"tp":3903.69557,"fp":6149.58354,"tn":12541.41646,"fn":1405.30443},{"t":0.29,"tp":3852.92486,"fp":5865.30755,"tn":12825.69245,"fn":1456.07514},{"t":0.3,"tp":3802.10837,"fp":5590.4183,"tn":13100.5817,"fn":1506.89163},{"t":0.31,"tp":3751.24539,"fp":5324.7333,"tn":13366.2667,"fn":1557.75461},{"t":0.32,"tp":3700.33521,"fp":5068.07109,"tn":13622.92891,"fn":1608.66479},{"t":0.33,"tp":3649.37708,"fp":4820.25118,"tn":13870.74882,"fn":1659.62292},{"t":0.34,"tp":3598.37026,"fp":4581.09413,"tn":14109.90587,"fn":1710.62974},{"t":0.35,"tp":3547.31395,"fp":4350.4215,"tn":14340.5785,"fn":1761.68605},{"t":0.36,"tp":3496.20735,"fp":4128.0559,"tn":14562.9441,"fn":1812.79265},{"t":0.37,"tp":3445.0496,"fp":3913.82098,"tn":14777.17902,"fn":1863.9504},{"t":0.38,"tp":3393.83987,"fp":3707.54145,"tn":14983.45855,"fn":1915.16013},{"t":0.39,"tp":3342.57723,"fp":3509.04307,"tn":15181.95693,"fn":1966.42277},{"t":0.4,"tp":3291.26079,"fp":3318.1527,"tn":15372.8473,"fn":2017.73921},{"t":0.41,"tp":3239.88957,"fp":3134.69827,"tn":15556.30173,"fn":2069.11043},{"t":0.42,"tp":3188.4626,"fp":2958.50882,"tn":15732.49118,"fn":2120.5374},{"t":0.43,"tp":3136.97885,"fp":2789.41447,"tn":15901.58553,"fn":2172.02115},{"t":0.44,"tp":3085.43725,"fp":2627.24649,"tn":16063.75351,"fn":2223.56275},{"t":0.45,"tp":3033.83671,"fp":2471.83728,"tn":16219.16272,"fn":2275.16329},{"t":0.46,"tp":2982.17609,"fp":2323.02038,"tn":16367.97962,"fn":2326.82391},{"t":0.47,"tp":2930.45421,"fp":2180.63049,"tn":16510.36951,"fn":2378.54579},{"t":0.48,"tp":2878.66982,"fp":2044.50347,"tn":16646.49653,"fn":2430.33018},{"t":0.49,"tp":2826.82166,"fp":1914.47638,"tn":16776.52362,"fn":2482.17834},{"t":0.5,"tp":2774.90839,"fp":1790.38748,"tn":16900.61252,"fn":2534.09161},{"t":0.51,"tp":2722.92862,"fp":1672.07623,"tn":17018.92377,"fn":2586.07138},{"t":0.52,"tp":2670.88091,"fp":1559.38332,"tn":17131.61668,"fn":2638.11909},{"t":0.53,"tp":2618.76375,"fp":1452.1507,"tn":17238.8493,"fn":2690.23625},{"t":0.54,"tp":2566.57557,"fp":1350.22156,"tn":17340.77844,"fn":2742.42443},{"t":0.55,"tp":2514.31472,"fp":1253.44039,"tn":17437.55961,"fn":2794.68528},{"t":0.56,"tp":2461.97949,"fp":1161.65294,"tn":17529.34706,"fn":2847.02051},{"t":0.57,"tp":2409.56807,"fp":1074.70629,"tn":17616.29371,"fn":2899.43193},{"t":0.58,"tp":2357.07858,"fp":992.44886,"tn":17698.55114,"fn":2951.92142},{"t":0.59,"tp":2304.50904,"fp":914.73039,"tn":17776.26961,"fn":3004.49096},{"t":0.6,"tp":2251.85736,"fp":841.40202,"tn":17849.59798,"fn":3057.14264},{"t":0.61,"tp":2199.12136,"fp":772.31624,"tn":17918.68376,"fn":3109.87864},{"t":0.62,"tp":2146.29875,"fp":707.32699,"tn":17983.67301,"fn":3162.70125},{"t":0.63,"tp":2093.38708,"fp":646.28961,"tn":18044.71039,"fn":3215.61292},{"t":0.64,"tp":2040.3838,"fp":589.0609,"tn":18101.9391,"fn":3268.6162},{"t":0.65,"tp":1987.28619,"fp":535.49917,"tn":18155.50083,"fn":3321.71381},{"t":0.66,"tp":1934.09139,"fp":485.46418,"tn":18205.53582,"fn":3374.90861},{"t":0.67,"tp":1880.79635,"fp":438.81727,"tn":18252.18273,"fn":3428.20365},{"t":0.68,"tp":1827.39783,"fp":395.4213,"tn":18295.5787,"fn":3481.60217},{"t":0.69,"tp":1773.89239,"fp":355.14075,"tn":18335.85925,"fn":3535.10761},{"t":0.7,"tp":1720.27635,"fp":317.84169,"tn":18373.15831,"fn":3588.72365},{"t":0.71,"tp":1666.54579,"fp":283.39185,"tn":18407.60815,"fn":3642.45421},{"t":0.72,"tp":1612.6965,"fp":251.66065,"tn":18439.33935,"fn":3696.3035},{"t":0.73,"tp":1558.72395,"fp":222.51921,"tn":18468.48079,"fn":3750.27605},{"t":0.74,"tp":1504.62329,"fp":195.84043,"tn":18495.15957,"fn":3804.37671},{"t":0.75,"tp":1450.38925,"fp":171.49897,"tn":18519.50103,"fn":3858.61075},{"t":0.76,"tp":1396.01617,"fp":149.37138,"tn":18541.62862,"fn":3912.98383},{"t":0.77,"tp":1341.49785,"fp":129.33603,"tn":18561.66397,"fn":3967.50215},{"t":0.78,"tp":1286.82756,"fp":111.27328,"tn":18579.72672,"fn":4022.17244},{"t":0.79,"tp":1231.99795,"fp":95.06543,"tn":18595.93457,"fn":4077.00205},{"t":0.8,"tp":1177.00092,"fp":80.59685,"tn":18610.40315,"fn":4131.99908},{"t":0.81,"tp":1121.82754,"fp":67.75397,"tn":18623.24603,"fn":4187.17246},{"t":0.82,"tp":1066.46791,"fp":56.42541,"tn":18634.57459,"fn":4242.53209},{"t":0.83,"tp":1010.91098,"fp":46.50201,"tn":18644.49799,"fn":4298.08902},{"t":0.84,"tp":955.14439,"fp":37.87691,"tn":18653.12309,"fn":4353.85561},{"t":0.85,"tp":899.15413,"fp":30.44566,"tn":18660.55434,"fn":4409.84587},{"t":0.86,"tp":842.92429,"fp":24.10626,"tn":18666.89374,"fn":4466.07571},{"t":0.87,"tp":786.43657,"fp":18.75931,"tn":18672.24069,"fn":4522.56343},{"t":0.88,"tp":729.6698,"fp":14.3081,"tn":18676.6919,"fn":4579.3302},{"t":0.89,"tp":672.5991,"fp":10.65873,"tn":18680.34127,"fn":4636.4009},{"t":0.9,"tp":615.1949,"fp":7.72027,"tn":18683.27973,"fn":4693.8051},{"t":0.91,"tp":557.4215,"fp":5.40492,"tn":18685.59508,"fn":4751.5785},{"t":0.92,"tp":499.23492,"fp":3.62818,"tn":18687.37182,"fn":4809.76508},{"t":0.93,"tp":440.57971,"fp":2.30911,"tn":18688.69089,"fn":4868.42029},{"t":0.94,"tp":381.38385,"fp":1.37055,"tn":18689.62945,"fn":4927.61615},{"t":0.95,"tp":321.5501,"fp":0.73952,"tn":18690.26048,"fn":4987.4499},{"t":0.96,"tp":260.94013,"fp":0.34754,"tn":18690.65246,"fn":5048.05987},{"t":0.97,"tp":199.34173,"fp":0.13128,"tn":18690.86872,"fn":5109.65827},{"t":0.98,"tp":136.3882,"fp":0.03329,"tn":18690.96671,"fn":5172.6118},{"t":0.99,"tp":71.28739,"fp":0.00319,"tn":18690.99681,"fn":5237.71261},{"t":1.0,"tp":0.0,"fp":0.0,"tn":18691.0,"fn":5309.0}],"roc":[[0.0,0.0],[0.01,0.12141],[0.0201,0.16715],[0.03021,0.20141],[0.04031,0.22985],[0.05041,0.25464],[0.06052,0.27685],[0.07062,0.29713],[0.08072,0.31589],[0.09082,0.33342],[0.10093,0.